paper_id,title,assignment_scope,module_code,module_kind,sort_order,active_confirmed_core
ASD-0492,Data-Driven Design and Autonomous Experimentation in Soft and Biological Materials Engineering,scientific_object_modules,04,formal_module,1,0
ASD-0493,Physics-informed machine learning,scientific_object_modules,01,formal_module,1,0
ASD-0494,"Review of deep learning: concepts, CNN architectures, challenges, applications, future directions",scientific_object_modules,01,formal_module,1,0
ASD-0495,Machine learning for perovskite materials design and discovery,scientific_object_modules,04,formal_module,1,0
ASD-0496,Deep Learning for Generic Object Detection: A Survey,scientific_object_modules,01,formal_module,1,0
ASD-0497,Toward an Architecture for Never-Ending Language Learning,scientific_object_modules,01,formal_module,1,0
ASD-0498,Automated Machine Learning,scientific_object_modules,01,formal_module,1,0
ASD-0499,Genetic algorithms for computational materials discovery accelerated by machine learning,scientific_object_modules,04,formal_module,1,0
ASD-0500,The Role of Machine Learning in the Understanding and Design of Materials,scientific_object_modules,04,formal_module,1,0
ASD-0501,Functional genomic hypothesis generation and experimentation by a robot scientist,scientific_object_modules,06,formal_module,1,1
ASD-0502,The Automation of Science,scientific_object_modules,11,formal_module,1,0
ASD-0503,Self-driving laboratory for accelerated discovery of thin-film materials,scientific_object_modules,04,formal_module,1,1
ASD-0504,A Bayesian experimental autonomous researcher for mechanical design,scientific_object_modules,09,formal_module,1,1
ASD-0505,Autonomous and dynamic precursor selection for solid-state materials synthesis,scientific_object_modules,04,formal_module,1,1
ASD-0506,Closed-loop transfer enables artificial intelligence to yield chemical knowledge,scientific_object_modules,03,formal_module,1,1
ASD-0507,Identifying general reaction conditions by bandit optimization,scientific_object_modules,03,formal_module,1,1
ASD-0508,"Autonomous, multiproperty-driven molecular discovery: From predictions to measurements and back",scientific_object_modules,03,formal_module,1,1
ASD-0510,A conversational multi-agent AI system for automated plant phenotyping,scientific_object_modules,06,formal_module,1,1
ASD-0510,A conversational multi-agent AI system for automated plant phenotyping,scientific_object_modules,08,formal_module,2,1
ASD-0511,Operating advanced scientific instruments with AI agents that learn on the job,scientific_object_modules,04,formal_module,1,1
ASD-0511,Operating advanced scientific instruments with AI agents that learn on the job,scientific_object_modules,09,formal_module,2,1
ASD-0512,Mathematical discoveries from program search with large language models,scientific_object_modules,01,formal_module,1,1
ASD-0513,Networking autonomous material exploration systems through transfer learning,scientific_object_modules,04,formal_module,1,1
ASD-0514,Autonomous phase mapping of gold nanoparticles synthesis with differentiable models of spectral shape,scientific_object_modules,04,formal_module,1,1
ASD-0515,Autonomous closed-loop exploration of composition-spread films for the anomalous Hall effect,scientific_object_modules,04,formal_module,1,1
ASD-0516,A self-driving physical vapor deposition system making sample-specific decisions on the fly,scientific_object_modules,04,formal_module,1,1
ASD-0516,A self-driving physical vapor deposition system making sample-specific decisions on the fly,scientific_object_modules,09,formal_module,2,1
ASD-0517,Self-driving lab for the photochemical synthesis of plasmonic nanoparticles with targeted structural and optical properties,scientific_object_modules,04,formal_module,1,1
ASD-0518,A generalized platform for artificial intelligence-powered autonomous enzyme engineering,scientific_object_modules,06,formal_module,1,1
ASD-0519,A high-throughput experimentation platform for data-driven discovery in electrochemistry,scientific_object_modules,03,formal_module,1,1
ASD-0519,A high-throughput experimentation platform for data-driven discovery in electrochemistry,scientific_object_modules,04,formal_module,2,1
ASD-0520,Bayesian learning-assisted catalyst discovery for efficient iridium utilization in electrochemical water splitting,scientific_object_modules,03,formal_module,1,1
ASD-0520,Bayesian learning-assisted catalyst discovery for efficient iridium utilization in electrochemical water splitting,scientific_object_modules,04,formal_module,2,1
ASD-0521,CRISPR-GPT for agentic automation of gene-editing experiments,scientific_object_modules,06,formal_module,1,1
ASD-0522,Evaluating large language model agents for automation of atomic force microscopy,scientific_object_modules,04,formal_module,1,1
ASD-0522,Evaluating large language model agents for automation of atomic force microscopy,scientific_object_modules,09,formal_module,2,1
ASD-0523,Towards end-to-end automation of AI research,scientific_object_modules,01,formal_module,1,1
ASD-0523,Towards end-to-end automation of AI research,scientific_object_modules,11,formal_module,2,1
ASD-0524,AgenticSciML: collaborative multi-agent systems for emergent discovery in scientific machine learning,scientific_object_modules,01,formal_module,1,1
ASD-0525,TeLLAgent: a dual-agent framework for reliable scientific discovery with tool-enhanced LLMs,scientific_object_modules,03,formal_module,1,1
ASD-0525,TeLLAgent: a dual-agent framework for reliable scientific discovery with tool-enhanced LLMs,scientific_object_modules,04,formal_module,2,1
ASD-0526,Constitutive scientific generative agent (CSGA): Leveraging large language models for automated constitutive model discovery,scientific_object_modules,09,formal_module,1,1
ASD-0528,AutoSciLab: A Self-Driving Laboratory for Interpretable Scientific Discovery,scientific_object_modules,02,formal_module,1,1
ASD-0529,RAISE: a self-driving laboratory for interfacial property formulation discovery,scientific_object_modules,04,formal_module,1,1
ASD-0531,GALILEO: Embodied AI scientist for autonomous therapeutic discovery in dynamic membrane systems,scientific_object_modules,06,formal_module,1,1
ASD-0531,GALILEO: Embodied AI scientist for autonomous therapeutic discovery in dynamic membrane systems,scientific_object_modules,07,formal_module,2,1
ASD-0532,CellVoyager: AI CompBio agent generates new insights by autonomously analyzing biological data,scientific_object_modules,06,formal_module,1,0
ASD-0533,LIDDIA: Language-based Intelligent Drug Discovery Agent,scientific_object_modules,07,formal_module,1,0
ASD-0534,ProtAgents: protein discovery via large language model multi-agent collaborations combining physics and machine learning,scientific_object_modules,06,formal_module,1,0
ASD-0535,Accelerated inorganic materials design with generative AI agents,scientific_object_modules,04,formal_module,1,1
ASD-0536,TCM-Agent: Advancing Network Pharmacology and Herbal Medicine Discovery with LLM-Based Multi-Agent Systems,scientific_object_modules,07,formal_module,1,1
ASD-0537,Medea: An omics AI agent for therapeutic discovery,scientific_object_modules,06,formal_module,1,1
ASD-0537,Medea: An omics AI agent for therapeutic discovery,scientific_object_modules,07,formal_module,2,1
ASD-0538,Masgent: an AI-assisted materials simulation agent,scientific_object_modules,04,formal_module,1,1
ASD-0539,Accelerating materials discovery via AI-Agent integration of large language models and simulation tools,scientific_object_modules,03,formal_module,1,1
ASD-0539,Accelerating materials discovery via AI-Agent integration of large language models and simulation tools,scientific_object_modules,04,formal_module,2,1
ASD-0540,A multi-agent system for automating scientific discovery,scientific_object_modules,06,formal_module,1,1
ASD-0540,A multi-agent system for automating scientific discovery,scientific_object_modules,07,formal_module,2,1
ASD-0542,MADD: Multi-Agent Drug Discovery Orchestra,scientific_object_modules,07,formal_module,1,1
ASD-0543,Machine Learning Copilot Agent: An LLM-Guided Workflow for Prognostic Gene Discovery,scientific_object_modules,06,formal_module,1,1
ASD-0543,Machine Learning Copilot Agent: An LLM-Guided Workflow for Prognostic Gene Discovery,scientific_object_modules,07,formal_module,2,1
ASD-0544,LLM-Agent Powered Automated Literature Review and Hypothesis Generation for Cancer Biomarker Discovery,scientific_object_modules,07,formal_module,1,1
ASD-0545,IMMUNIA: A Multi-LLM Reasoning Agent for Immunoregulatory Surfaceome Discovery,scientific_object_modules,06,formal_module,1,1
ASD-0545,IMMUNIA: A Multi-LLM Reasoning Agent for Immunoregulatory Surfaceome Discovery,scientific_object_modules,07,formal_module,2,1
ASD-0546,Accelerating earth science discovery via multi-agent LLM systems,scientific_object_modules,05,formal_module,1,0
ASD-0547,Closed-loop experimental AI for pixelated metasurface design,scientific_object_modules,04,formal_module,1,1
ASD-0548,OpenScientist: evaluating an open agentic AI co-scientist to accelerate biomedical discovery,scientific_object_modules,06,formal_module,1,1
ASD-0548,OpenScientist: evaluating an open agentic AI co-scientist to accelerate biomedical discovery,scientific_object_modules,07,formal_module,2,1
ASD-0549,DeepInflation: An AI Agent for Research and Model Discovery of Inflation,scientific_object_modules,02,formal_module,1,1
ASD-0550,Catalyst discovery through AI agent collaboration,scientific_object_modules,03,formal_module,1,0
ASD-0551,PANGAEA GPT: A Coordinated Multi-Agent Architecture for Earth System Data Discovery and Analysis,scientific_object_modules,05,formal_module,1,0
ASD-0552,Multi agent large language models for biomedical hypothesis generation in drug combination discovery,scientific_object_modules,07,formal_module,1,1
ASD-0554,BioAgent: An Auditable Multi-Agent Framework for Reproducible Translational Bioinformatics,scientific_object_modules,06,formal_module,1,1
ASD-0554,BioAgent: An Auditable Multi-Agent Framework for Reproducible Translational Bioinformatics,scientific_object_modules,07,formal_module,2,1
ASD-0556,DrugPilot: LLM-based Parameterized Reasoning Agent for Drug Discovery,scientific_object_modules,07,formal_module,1,1
ASD-0557,"Unlocking azobenzene isomerization mechanisms via an LLM agent-driven workflow integrating simulation, experiment, and machine learning",scientific_object_modules,03,formal_module,1,1
ASD-0558,Closed-Loop AI Enables Organic Continuous-Wave Laser,scientific_object_modules,04,formal_module,1,1
ASD-0559,Evaluating open LLMs for agentic analysis orchestration in a typical biomedical lab,scientific_object_modules,06,formal_module,1,0
ASD-0560,Evaluating agentic AI for biological discovery in autonomous and copilot settings,scientific_object_modules,06,formal_module,1,0
ASD-0563,Accelerating multimetallic catalyst discovery with robotics and agentic AI,scientific_object_modules,04,formal_module,1,0
ASD-0564,An agentic framework for autonomous scientific discovery in cancer pathology,scientific_object_modules,07,formal_module,1,1
ASD-0564,An agentic framework for autonomous scientific discovery in cancer pathology,scientific_object_modules,06,formal_module,2,1
ASD-0565,Agentic AI for autonomous discovery of radiation-tolerant CoCrFeMnNi high entropy alloys,scientific_object_modules,04,formal_module,1,1
ASD-0566,Autonomous Laboratory Planning Agent for Solid-State Form Selection and Polymorph Screening,scientific_object_modules,07,formal_module,1,0
ASD-0567,Egent: An Autonomous Agent for Equivalent Width Measurement,scientific_object_modules,02,formal_module,1,1
ASD-0568,Multi-Agent-Network-Based Idea Generator for Zinc-Ion Battery Electrolyte Discovery: A Case Study on Zinc Tetrafluoroborate Hydrate-Based Deep Eutectic Electrolytes,scientific_object_modules,04,formal_module,1,1
ASD-0569,Autonomous Nanocrystal Doping by Self-Driving Fluidic Micro-Processors,scientific_object_modules,04,formal_module,1,1
ASD-0570,Knowledge-driven autonomous materials research via collaborative multi-agent and robotic system,scientific_object_modules,04,formal_module,1,1
ASD-0571,CRYSTAL: a multi-agent AI system for automated mapping of materials' crystal structures,scientific_object_modules,04,formal_module,1,1
ASD-0572,Autonomous discovery of functional random heteropolymer blends through evolutionary formulation optimization,scientific_object_modules,04,formal_module,1,1
ASD-0572,Autonomous discovery of functional random heteropolymer blends through evolutionary formulation optimization,scientific_object_modules,06,formal_module,2,1
ASD-0573,A Self-Driving Fluidic Lab for Data-Driven Synthesis of Lead-Free Perovskite Nanocrystals,scientific_object_modules,04,formal_module,1,1
ASD-0574,GeneAgent: self-verification language agent for gene-set analysis using domain databases,scientific_object_modules,06,formal_module,1,1
ASD-0575,A curious formulation robot enables the discovery of a novel protocell behavior,scientific_object_modules,03,formal_module,1,1
ASD-0576,Towards a fully automated algorithm driven platform for biosystems design,scientific_object_modules,06,formal_module,1,1
ASD-0577,Autonomous multi-robot synthesis and optimization of metal halide perovskite nanocrystals,scientific_object_modules,04,formal_module,1,1
ASD-0579,A Bayesian active learning platform for scalable combination drug screens,scientific_object_modules,07,formal_module,1,1
ASD-0580,A Bayesian active learning platform for scalable combination drug screens,scientific_object_modules,07,formal_module,1,0
ASD-0581,A chemical autonomous robotic platform for end-to-end synthesis of nanoparticles,scientific_object_modules,04,formal_module,1,1
ASD-0582,Autonomous platform for solution processing of electronic polymers,scientific_object_modules,04,formal_module,1,1
ASD-0583,Autonomous catalysis research with human-AI-robot collaboration,scientific_object_modules,03,formal_module,1,0
ASD-0584,Autonomous multi-robot synthesis and optimization of metal halide perovskite nanocrystals,scientific_object_modules,04,formal_module,1,0
ASD-0586,A virtual platform for automated hybrid organic-enzymatic synthesis planning,scientific_object_modules,03,formal_module,1,1
ASD-0587,Collective intelligence for AI-assisted chemical synthesis,scientific_object_modules,03,formal_module,1,1
ASD-0589,An integrated self-optimizing programmable chemical synthesis and reaction engine,scientific_object_modules,03,formal_module,1,1
ASD-0590,A robotic platform for the synthesis of colloidal nanocrystals,scientific_object_modules,04,formal_module,1,1
ASD-0591,Self-optimizing parallel millifluidic reactor for scaling nanoparticle synthesis,scientific_object_modules,04,formal_module,1,1
ASD-0592,Autonomous materials synthesis by machine learning and robotics,scientific_object_modules,04,formal_module,1,1
ASD-0617,An industrial automated laboratory for programmable protein evolution,scientific_object_modules,06,formal_module,1,1
ASD-0618,Integrating protein language models and automatic biofoundry for enhanced protein evolution,scientific_object_modules,06,formal_module,1,1
ASD-0595,In vitro continuous protein evolution empowered by machine learning and automation,scientific_object_modules,06,formal_module,1,0
ASD-0596,Operate a Cell-Free Biofoundry using Large Language Models,scientific_object_modules,06,formal_module,1,1
ASD-0597,Verification and execution of the scientific literature via chemputation augmented by large language models,scientific_object_modules,03,formal_module,1,1
ASD-0598,A Self-Driving Lab for Nano- and Advanced Materials Synthesis,scientific_object_modules,04,formal_module,1,1
ASD-0599,An AI-Native Biofoundry for Autonomous Enzyme Engineering: Integrating Active Learning with Automated Experimentation,scientific_object_modules,06,formal_module,1,1
ASD-0600,A universal system for digitization and automatic execution of the chemical synthesis literature,scientific_object_modules,03,formal_module,1,1
ASD-0601,"Automated self-optimization, intensification, and scale-up of photocatalysis in flow",scientific_object_modules,03,formal_module,1,1
ASD-0602,"An all-in-one multipurpose robotic platform for the self-optimization, intensification and scale-up of photocatalysis in flow",scientific_object_modules,03,formal_module,1,0
ASD-0603,Reconfigurable system for automated optimization of diverse chemical reactions,scientific_object_modules,03,formal_module,1,1
ASD-0604,Real-time experiment-theory closed-loop interaction for autonomous materials science,scientific_object_modules,04,formal_module,1,0
ASD-0605,Evolution of oil droplets in a chemorobotic platform,scientific_object_modules,03,formal_module,1,1
ASD-0606,Accelerate Synthesis of Metal-Organic Frameworks by a Robotic Platform and Bayesian Optimization,scientific_object_modules,04,formal_module,1,1
ASD-0607,Organic synthesis in a modular robotic system driven by a chemical programming language,scientific_object_modules,03,formal_module,1,1
ASD-0608,Autonomous Battery Optimization by Deploying Distributed Experiments and Simulations,scientific_object_modules,04,formal_module,1,1
ASD-0609,Automated pH Adjustment Driven by Robotic Workflows and Active Machine Learning,scientific_object_modules,03,formal_module,1,1
ASD-0610,Autonomous retrosynthesis of gold nanoparticles via spectral shape matching,scientific_object_modules,04,formal_module,1,1
ASD-0611,Autonomous materials synthesis via hierarchical active learning of nonequilibrium phase diagrams,scientific_object_modules,04,formal_module,1,1
ASD-0612,Navigating phase diagram complexity to guide robotic inorganic materials synthesis,scientific_object_modules,04,formal_module,1,1
ASD-0613,Physics Discovery in Nanoplasmonic Systems via Autonomous Experiments in Scanning Transmission Electron Microscopy,scientific_object_modules,02,formal_module,1,1
ASD-0614,"Modular, Multi-Robot Integration of Laboratories: An Autonomous Solid-State Workflow for Powder X-Ray Diffraction",scientific_object_modules,04,formal_module,1,1
ASD-0615,Using simulation to accelerate autonomous experimentation: A case study using mechanics,scientific_object_modules,09,formal_module,1,1
ASD-0616,NIMS-OS: An automation software to implement a closed loop between artificial intelligence and robotic experiments in materials science,scientific_object_modules,04,formal_module,1,0
ASD-0619,ChemOS 2.0: An orchestration architecture for chemical self-driving laboratories,scientific_object_modules,03,formal_module,1,0
ASD-0620,Enabling Modular Autonomous Feedback-Loops in Materials Science through Hierarchical Experimental Laboratory Automation and Orchestration,scientific_object_modules,04,formal_module,1,0
ASD-0621,An integrated high-throughput robotic platform and active learning approach for accelerated discovery of optimal electrolyte formulations,scientific_object_modules,04,formal_module,1,1
ASD-0622,Active learning accelerates electrolyte solvent screening for anode-free lithium metal batteries,scientific_object_modules,04,formal_module,1,1
ASD-0623,ClimAgent: LLM as Agents for Autonomous Open-ended Climate Science Analysis,scientific_object_modules,05,formal_module,1,1
ASD-0624,SciSciGPT: advancing human-AI collaboration in the science of science,scientific_object_modules,11,formal_module,1,1
ASD-0625,ReviewAgents: Bridging the Gap Between Human and AI-Generated Paper Reviews,scientific_object_modules,11,formal_module,1,1
ASD-0626,From Passive Generation to Investigation: A Proactive Scientific Peer Review Agent,scientific_object_modules,11,formal_module,1,1
ASD-0627,Adaptive Science Operations in Deep Space Missions Using Offline Belief State Planning,scientific_object_modules,10,formal_module,1,1
ASD-0628,ScholarPeer: A Context-Aware Multi-Agent Framework for Automated Peer Review,scientific_object_modules,11,formal_module,1,1
ASD-0629,CiteME: Can Language Models Accurately Cite Scientific Claims?,scientific_object_modules,11,formal_module,1,1
ASD-0630,Autonomous robotic experimentation system for powder X-ray diffraction,scientific_object_modules,04,formal_module,1,1
ASD-0631,Autonomous Discovery of Polymer Electrolyte Formulations with Warm-Start Batch Bayesian Optimization,scientific_object_modules,04,formal_module,1,1
ASD-0632,A Hierarchical Multi-Agent System for Autonomous Discovery in Geoscientific Data Archives,scientific_object_modules,05,formal_module,1,1
ASD-0633,A Self-Evolving AI Agent System for Climate Science,scientific_object_modules,05,formal_module,1,1
ASD-0634,Aleks: AI powered Multi Agent System for Autonomous Scientific Discovery via Data-Driven Approaches in Plant Science,scientific_object_modules,08,formal_module,1,1
ASD-0635,TianJi: An autonomous AI meteorologist for discovering physical mechanisms in atmospheric science,scientific_object_modules,05,formal_module,1,1
ASD-0636,EGTR-Review: Efficient Evidence-Grounded Scientific Peer Review,scientific_object_modules,11,formal_module,1,1
ASD-0637,Leveraging LLM-based agents for social science research: insights from citation network simulations,scientific_object_modules,11,formal_module,1,1
ASD-0638,OpenAg: Democratizing Agricultural Intelligence,scientific_object_modules,08,formal_module,1,0
ASD-0644,LLM Agents as Social Scientists: A Human-AI Collaborative Platform for Social Science Automation,scientific_object_modules,11,formal_module,1,1
ASD-0639,AgriAgent: Contract-Driven Planning and Capability-Aware Tool Orchestration in Real-World Agriculture,scientific_object_modules,08,formal_module,1,0
ASD-0640,ShizishanGPT: An Agricultural Large Language Model Integrating Tools and Resources,scientific_object_modules,08,formal_module,1,0
ASD-0641,AgriGPT: a Large Language Model Ecosystem for Agriculture,scientific_object_modules,08,formal_module,1,0
ASD-0642,Multimodal Agricultural Agent Architecture (MA3),scientific_object_modules,08,formal_module,1,0
ASD-0643,AgroAskAI: A Multi-Agentic AI Framework for Supporting Smallholder Farmers,scientific_object_modules,08,formal_module,1,0
ASD-0645,The Autonomous Sciencecraft Experiment Onboard the EO-1 Spacecraft,scientific_object_modules,10,formal_module,1,1
ASD-0646,The EO-1 Autonomous Science Agent,scientific_object_modules,10,formal_module,1,0
ASD-0647,Autonomous Small Body Science Operations Using Reinforcement Learning,scientific_object_modules,10,formal_module,1,1
ASD-0648,Reinforcement Learning For Earth-Observing Satellite Autonomy With Event-Based Task Intervals,scientific_object_modules,10,formal_module,1,1
ASD-0649,"CMIP-Forge: An Agentic System that Retrieves, Computes, and Self-Reviews Climate Science",scientific_object_modules,05,formal_module,1,1
ASD-0650,OpenEarth-Agent: From Tool Calling to Tool Creation for Open-Environment Earth Observation,scientific_object_modules,05,formal_module,1,1
ASD-0650,OpenEarth-Agent: From Tool Calling to Tool Creation for Open-Environment Earth Observation,scientific_object_modules,08,formal_module,2,1
ASD-0650,OpenEarth-Agent: From Tool Calling to Tool Creation for Open-Environment Earth Observation,scientific_object_modules,11,formal_module,3,1
ASD-0651,AI Driven Discovery of Bio Ecological Mediation in Cascading Heatwave Risks,scientific_object_modules,05,formal_module,1,1
ASD-0651,AI Driven Discovery of Bio Ecological Mediation in Cascading Heatwave Risks,scientific_object_modules,11,formal_module,2,1
ASD-0652,ResearchTown: Simulator of Human Research Community,scientific_object_modules,11,formal_module,1,1
ASD-0653,Earth-Agent: Unlocking the Full Landscape of Earth Observation with Agents,scientific_object_modules,05,formal_module,1,1
ASD-0654,HLER: Human-in-the-Loop Economic Research via Multi-Agent Pipelines for Empirical Discovery,scientific_object_modules,11,formal_module,1,1
ASD-0655,TreeReview: A Dynamic Tree of Questions Framework for Deep and Efficient LLM-based Scientific Peer Review,scientific_object_modules,11,formal_module,1,1
ASD-0656,AI-Assisted Peer Review at Scale: The AAAI-26 AI Review Pilot,scientific_object_modules,11,formal_module,1,1
ASD-0657,Vibe Researching as Wolf Coming: Can AI Agents with Skills Replace or Augment Social Scientists?,scientific_object_modules,11,formal_module,1,0
ASD-0658,"Read the Paper, Write the Code: Agentic Reproduction of Social-Science Results",scientific_object_modules,11,formal_module,1,1
ASD-0659,Autonomous Agents Coordinating Distributed Discovery Through Emergent Artifact Exchange,scientific_object_modules,04,formal_module,1,1
ASD-0659,Autonomous Agents Coordinating Distributed Discovery Through Emergent Artifact Exchange,scientific_object_modules,06,formal_module,2,1
ASD-0659,Autonomous Agents Coordinating Distributed Discovery Through Emergent Artifact Exchange,scientific_object_modules,07,formal_module,3,1
ASD-0659,Autonomous Agents Coordinating Distributed Discovery Through Emergent Artifact Exchange,scientific_object_modules,11,formal_module,4,1
ASD-0660,S1-NexusAgent: a Self-Evolving Agent Framework for Multidisciplinary Scientific Research,scientific_object_modules,03,formal_module,1,1
ASD-0660,S1-NexusAgent: a Self-Evolving Agent Framework for Multidisciplinary Scientific Research,scientific_object_modules,04,formal_module,2,1
ASD-0660,S1-NexusAgent: a Self-Evolving Agent Framework for Multidisciplinary Scientific Research,scientific_object_modules,06,formal_module,3,1
ASD-0660,S1-NexusAgent: a Self-Evolving Agent Framework for Multidisciplinary Scientific Research,scientific_object_modules,07,formal_module,4,1
ASD-0661,Robin: A multi-agent system for automating scientific discovery,scientific_object_modules,07,formal_module,1,0
ASD-0662,Mimosa Framework: Toward Evolving Multi-Agent Systems for Scientific Research,scientific_object_modules,03,formal_module,1,1
ASD-0662,Mimosa Framework: Toward Evolving Multi-Agent Systems for Scientific Research,scientific_object_modules,05,formal_module,2,1
