paper_id,title,assignment_scope,module_code,module_kind,sort_order,active_confirmed_core
ASD-0200,Rapid and automated alloy design with graph neural network-powered llm-driven multi-agent systems,scientific_object_modules,04,formal_module,1,0
ASD-0201,Sciagents: Automating scientific discovery through multi-agent intelligent graph reasoning,scientific_object_modules,04,formal_module,1,0
ASD-0203,Critic: Large language models can self-correct with tool-interactive critiquing,scientific_object_modules,01,formal_module,1,0
ASD-0204,Unsupervised identification of topological phase transitions using predictive models,scientific_object_modules,02,formal_module,1,0
ASD-0205,Deepseek-r1: Incentivizing reasoning capability in llms via reinforcement learning,scientific_object_modules,01,formal_module,1,0
ASD-0206,Can large language models play games? a case study of a self-play approach,scientific_object_modules,01,formal_module,1,0
ASD-0210,Large-scale foundation model on single-cell transcriptomics,scientific_object_modules,06,formal_module,1,0
ASD-0211,Simulating 500 million years of evolution with a language model,scientific_object_modules,06,formal_module,1,0
ASD-0212,"Control risk for potential misuse of artificial intelligence in science, 2023",scientific_object_modules,11,formal_module,1,0
ASD-0213,LEGO: A multi-agent collaborative framework with role-playing and iterative feedback for causality explanation generation,scientific_object_modules,01,formal_module,1,0
ASD-0215,Molecular design in synthetically accessible chemical space via deep reinforcement learning,scientific_object_modules,03,formal_module,1,0
ASD-0217,Aitomia: Your intelligent assistant for ai-driven atomistic and quantum chemical simulations,scientific_object_modules,03,formal_module,1,0
ASD-0219,An overview of artificial intelligence ethics,scientific_object_modules,11,formal_module,1,0
ASD-0221,Adaptive iterative feedback prompting for obstacle-aware path planning via llms,scientific_object_modules,09,formal_module,1,0
ASD-0222,Improving physics reasoning in large language models using mixture of refinement agents,scientific_object_modules,02,formal_module,1,0
ASD-0227,Highly accurate protein structure prediction with alphafold,scientific_object_modules,06,formal_module,1,0
ASD-0228,Massnet: billion-scale ai-friendly mass spectral corpus enables robust de novo peptide sequencing,scientific_object_modules,06,formal_module,1,0
ASD-0232,Mdagents: An adaptive collaboration of llms for medical decision-making,scientific_object_modules,07,formal_module,1,0
ASD-0235,"Local climate services for all, courtesy of large language models",scientific_object_modules,05,formal_module,1,0
ASD-0237,"Ds-1000: A natural and reliable benchmark for data science code generation, 2022",scientific_object_modules,01,formal_module,1,0
ASD-0238,A survey on enhancing reinforcement learning in complex environments: Insights from human and llm feedback,scientific_object_modules,01,formal_module,1,0
ASD-0239,Retrieval-augmented generation for knowledge-intensive nlp tasks,scientific_object_modules,01,formal_module,1,0
ASD-0240,Metal: A multi-agent framework for chart generation with test-time scaling,scientific_object_modules,01,formal_module,1,0
ASD-0243,"Agent alignment in evolving social norms, 20242",scientific_object_modules,11,formal_module,1,0
ASD-0248,Current and emerging deep-learning methods for the simulation of fluid dynamics,scientific_object_modules,09,formal_module,1,0
ASD-0254,From intention to implementation: automating biomedical research via llms,scientific_object_modules,06,formal_module,1,1
ASD-0254,From intention to implementation: automating biomedical research via llms,scientific_object_modules,07,formal_module,2,1
ASD-0256,Llm-mars: Large language model for behavior tree generation and nlp-enhanced dialogue in multi-agent robot systems,scientific_object_modules,09,formal_module,1,0
ASD-0262,A survey of context engineering for large language models,scientific_object_modules,01,formal_module,1,0
ASD-0264,Sequence modeling and design from molecular to genome scale with evo,scientific_object_modules,06,formal_module,1,0
ASD-0265,Astrollama: Towards specialized foundation models in astronomy,scientific_object_modules,02,formal_module,1,0
ASD-0266,"Claimcheck: How grounded are llm critiques of scientific papers?, 2025",scientific_object_modules,11,formal_module,1,0
ASD-0268,Quantum many-body physics calculations with large language models,scientific_object_modules,02,formal_module,1,0
ASD-0270,"Science in the era of chatgpt, large language models and generative ai",scientific_object_modules,11,formal_module,1,0
ASD-0275,Universal biological sequence reranking for improved de novo peptide sequencing,scientific_object_modules,06,formal_module,1,0
ASD-0276,Automating exploratory multiomics research via language models,scientific_object_modules,06,formal_module,1,1
ASD-0276,Automating exploratory multiomics research via language models,scientific_object_modules,07,formal_module,2,1
ASD-0278,Msa transformer,scientific_object_modules,06,formal_module,1,0
ASD-0280,An automatic end-to-end chemical synthesis development platform powered by large language models,scientific_object_modules,03,formal_module,1,1
ASD-0281,Accelerated end-to-end chemical synthesis development with large language models,scientific_object_modules,03,formal_module,1,0
ASD-0287,Can llms generate novel research ideas? a large-scale human study with 100+ nlp researchers,scientific_object_modules,11,formal_module,1,0
ASD-0288,A multi-agent-driven robotic ai chemist enabling autonomous chemical research on demand,scientific_object_modules,03,formal_module,1,0
ASD-0290,ChemReasoner: Heuristic search over a large language model's knowledge space using quantum-chemical feedback,scientific_object_modules,03,formal_module,1,1
ASD-0294,Redefining Work in the Age of AI: Challenges and Pathways to Opportunities,scientific_object_modules,11,formal_module,1,0
ASD-0295,Chemmllm: Chemical multimodal large language model,scientific_object_modules,03,formal_module,1,0
ASD-0296,MedAgents: Large language models as collaborators for zero-shot medical reasoning,scientific_object_modules,07,formal_module,1,0
ASD-0299,Climategpt: Towards ai synthesizing interdisciplinary research on climate change,scientific_object_modules,05,formal_module,1,0
ASD-0300,Mujoco: A physics engine for model-based control,scientific_object_modules,09,formal_module,1,0
ASD-0305,Grovergpt: A large language model with 8 billion parameters for quantum searching,scientific_object_modules,02,formal_module,1,0
ASD-0309,A survey of llm-based agents in medicine: How far are we from baymax?,scientific_object_modules,07,formal_module,1,0
ASD-0314,Identification of blue horizontal branch stars with multimodal fusion,scientific_object_modules,02,formal_module,1,0
ASD-0316,Deep learning in proteomics,scientific_object_modules,06,formal_module,1,0
ASD-0324,"Advancing ai-scientist understanding: Making llm think like a physicist with interpretable reasoning, 20252",scientific_object_modules,02,formal_module,1,0
ASD-0325,What if llms have different world views: Simulating alien civilizations with llm-based agents,scientific_object_modules,11,formal_module,1,0
ASD-0326,Periodic graph transformers for crystal material property prediction,scientific_object_modules,04,formal_module,1,0
ASD-0327,Complete and efficient graph transformers for crystal material property prediction,scientific_object_modules,04,formal_module,1,0
ASD-0328,"Mattersim: A deep learning atomistic model across elements, temperatures and pressures",scientific_object_modules,04,formal_module,1,0
ASD-0329,Poisoning medical knowledge using large language models,scientific_object_modules,07,formal_module,1,0
ASD-0332,Alphafold2 and its applications in the fields of biology and medicine,scientific_object_modules,06,formal_module,1,0
ASD-0333,MOOSE-Chem: Large language models for rediscovering unseen chemistry scientific hypotheses,scientific_object_modules,03,formal_module,1,1
ASD-0335,Studying and improving reasoning in humans and machines,scientific_object_modules,11,formal_module,1,0
ASD-0340,"Text2chart31: Instruction tuning for chart generation with automatic feedback, 2025",scientific_object_modules,01,formal_module,1,0
ASD-0342,The good and the bad: Exploring privacy issues in retrieval-augmented generation (rag),scientific_object_modules,01,formal_module,1,0
ASD-0343,A generative model for inorganic materials design,scientific_object_modules,04,formal_module,1,0
ASD-0346,Chemllm: A chemical large language model,scientific_object_modules,03,formal_module,1,0
ASD-0347,"The evolving role of large language models in scientific innovation: Evaluator, collaborator, and scientist",scientific_object_modules,11,formal_module,1,0
ASD-0351,Scientific large language models: A survey on biological & chemical domains,scientific_object_modules,03,formal_module,1,0
ASD-0353,π \pi -primenovo: an accurate and efficient non-autoregressive deep learning model for de novo peptide sequencing,scientific_object_modules,06,formal_module,1,0
ASD-0354,Curriculum learning for biological sequence prediction: The case of de novo peptide sequencing,scientific_object_modules,06,formal_module,1,0
ASD-0355,Transformer quantum state: A multipurpose model for quantum many-body problems,scientific_object_modules,02,formal_module,1,0
ASD-0356,Siren’s song in the ai ocean: A survey on hallucination in large language models,scientific_object_modules,01,formal_module,1,0
ASD-0357,Origene: A self-evolving virtual disease biologist automating therapeutic target discovery,scientific_object_modules,07,formal_module,1,1
ASD-0365,Fluid-llm: Learning computational fluid dynamics with spatiotemporal-aware large language models,scientific_object_modules,09,formal_module,1,0
ASD-0367,Advancing biomolecular understanding and design following human instructions,scientific_object_modules,06,formal_module,1,0
ASD-0368,Self-Driving Laboratories for Chemistry and Materials Science,scientific_object_modules,03,formal_module,1,0
ASD-0369,Next-Generation Experimentation with Self-Driving Laboratories,scientific_object_modules,03,formal_module,1,0
ASD-0370,Self-driving laboratories to autonomously navigate the protein fitness landscape,scientific_object_modules,06,formal_module,1,1
ASD-0371,An autonomous laboratory for the accelerated synthesis of inorganic materials,scientific_object_modules,04,formal_module,1,0
ASD-0374,The rise of self-driving labs in chemical and materials sciences,scientific_object_modules,03,formal_module,1,0
ASD-0375,Autonomous Chemical Experiments: Challenges and Perspectives on Establishing a Self-Driving Lab,scientific_object_modules,03,formal_module,1,0
ASD-0376,Self-Driving Laboratory for Polymer Electronics,scientific_object_modules,04,formal_module,1,0
ASD-0377,Autonomous chemical science and engineering enabled by self-driving laboratories,scientific_object_modules,03,formal_module,1,0
ASD-0378,Natural Products for Drug Discovery in the 21st Century: Innovations for Novel Drug Discovery,scientific_object_modules,07,formal_module,1,0
ASD-0379,A self-driving laboratory advances the Pareto front for material properties,scientific_object_modules,04,formal_module,1,1
ASD-0380,Towards the sustainable discovery and development of new antibiotics,scientific_object_modules,07,formal_module,1,0
ASD-0381,Autonomous reaction Pareto-front mapping with a self-driving catalysis laboratory,scientific_object_modules,03,formal_module,1,1
ASD-0382,Toward autonomous design and synthesis of novel inorganic materials,scientific_object_modules,04,formal_module,1,0
ASD-0385,AlphaFlow: autonomous discovery and optimization of multi-step chemistry using a self-driven fluidic lab guided by reinforcement learning,scientific_object_modules,03,formal_module,1,1
ASD-0385,AlphaFlow: autonomous discovery and optimization of multi-step chemistry using a self-driven fluidic lab guided by reinforcement learning,scientific_object_modules,04,formal_module,2,1
ASD-0388,Crystallography companion agent for high-throughput materials discovery,scientific_object_modules,04,formal_module,1,1
ASD-0389,Autonomous discovery of optically active chiral inorganic perovskite nanocrystals through an intelligent cloud lab,scientific_object_modules,04,formal_module,1,1
ASD-0390,A self-driving laboratory designed to accelerate the discovery of adhesive materials,scientific_object_modules,04,formal_module,1,1
ASD-0391,Review of low-cost self-driving laboratories in chemistry and materials science: the “frugal twin�?concept,scientific_object_modules,03,formal_module,1,0
ASD-0392,Jaguar: A high‐performance quantum chemistry software program with strengths in life and materials sciences,scientific_object_modules,03,formal_module,1,0
ASD-0393,Click Chemistry in Materials Science,scientific_object_modules,04,formal_module,1,0
ASD-0394,Graph neural networks for materials science and chemistry,scientific_object_modules,03,formal_module,1,0
ASD-0395,Recent advances and applications of machine learning in solid-state materials science,scientific_object_modules,04,formal_module,1,0
ASD-0396,Mars Science Laboratory Mission and Science Investigation,scientific_object_modules,10,formal_module,1,0
ASD-0397,Modeling nitrogen chemistry in combustion,scientific_object_modules,03,formal_module,1,0
ASD-0398,Recent advances and applications of deep learning methods in materials science,scientific_object_modules,04,formal_module,1,0
ASD-0399,The physics and chemistry of the Schottky barrier height,scientific_object_modules,04,formal_module,1,0
ASD-0400,"Science and technology roadmap for graphene, related two-dimensional crystals, and hybrid systems",scientific_object_modules,04,formal_module,1,0
ASD-0401,DScribe: Library of descriptors for machine learning in materials science,scientific_object_modules,04,formal_module,1,0
ASD-0402,Self-Driving Laboratories for Development of New Functional Materials and Optimizing Known Reactions,scientific_object_modules,04,formal_module,1,0
ASD-0403,Nanocellulose as a natural source for groundbreaking applications in materials science: Today’s state,scientific_object_modules,04,formal_module,1,0
ASD-0404,The surface chemistry of cerium oxide,scientific_object_modules,03,formal_module,1,0
ASD-0405,Supramolecular self-assemblies as functional nanomaterials,scientific_object_modules,04,formal_module,1,0
ASD-0406,A revolutionary paradigm in chemistry and materials science research: self-driving laboratories,scientific_object_modules,03,formal_module,1,0
ASD-0407,"Data‐Driven Materials Science: Status, Challenges, and Perspectives",scientific_object_modules,04,formal_module,1,0
ASD-0408,"Social Science Research: Principles, Methods and Practices",scientific_object_modules,11,formal_module,1,0
ASD-0409,Autonomous experimentation systems for materials development: A community perspective,scientific_object_modules,04,formal_module,1,0
ASD-0410,On-the-fly closed-loop materials discovery via Bayesian active learning,scientific_object_modules,04,formal_module,1,1
ASD-0411,Autonomy in materials research: a case study in carbon nanotube growth,scientific_object_modules,04,formal_module,1,0
ASD-0412,Accelerating the discovery of materials for clean energy in the era of smart automation,scientific_object_modules,04,formal_module,1,0
ASD-0413,Progress and prospects for accelerating materials science with automated and autonomous workflows,scientific_object_modules,04,formal_module,1,0
ASD-0414,"Accelerating materials discovery using artificial intelligence, high performance computing and robotics",scientific_object_modules,04,formal_module,1,0
ASD-0415,Autonomous polymer synthesis delivered by multi-objective closed-loop optimisation,scientific_object_modules,04,formal_module,1,1
ASD-0416,Universal Chemical Synthesis and Discovery with ‘The Chemputer�?,scientific_object_modules,03,formal_module,1,0
ASD-0417,Autonomous optimization of non-aqueous Li-ion battery electrolytes via robotic experimentation and machine learning coupling,scientific_object_modules,04,formal_module,1,1
ASD-0418,Data-science driven autonomous process optimization,scientific_object_modules,03,formal_module,1,1
ASD-0419,New frontiers for the materials genome initiative,scientific_object_modules,04,formal_module,1,0
ASD-0420,Emerging materials intelligence ecosystems propelled by machine learning,scientific_object_modules,04,formal_module,1,0
ASD-0421,Closed-loop superconducting materials discovery,scientific_object_modules,04,formal_module,1,1
ASD-0422,Autonomous closed-loop mechanistic investigation of molecular electrochemistry via automation,scientific_object_modules,03,formal_module,1,1
ASD-0423,Role of AI in experimental materials science,scientific_object_modules,04,formal_module,1,0
ASD-0424,A field guide to flow chemistry for synthetic organic chemists,scientific_object_modules,03,formal_module,1,0
ASD-0425,Efficient Closed-loop Maximization of Carbon Nanotube Growth Rate using Bayesian Optimization,scientific_object_modules,04,formal_module,1,1
ASD-0427,Autonomous chemistry: Navigating self-driving labs in chemical and material sciences,scientific_object_modules,03,formal_module,1,0
ASD-0428,Discovering New Chemistry with an Autonomous Robotic Platform Driven by a Reactivity-Seeking Neural Network,scientific_object_modules,03,formal_module,1,1
ASD-0429,Toward autonomous additive manufacturing: Bayesian optimization on a 3D printer,scientific_object_modules,09,formal_module,1,1
ASD-0430,Wearable and implantable biosensors: mechanisms and applications in closed-loop therapeutic systems,scientific_object_modules,07,formal_module,1,0
ASD-0431,Machine learning for automated experimentation in scanning transmission electron microscopy,scientific_object_modules,04,formal_module,1,0
ASD-0433,Gaussian processes for autonomous data acquisition at large-scale synchrotron and neutron facilities,scientific_object_modules,02,formal_module,1,0
ASD-0434,Natural products in drug discovery: advances and opportunities,scientific_object_modules,07,formal_module,1,0
ASD-0435,Machine learning for molecular and materials science,scientific_object_modules,03,formal_module,1,0
ASD-0436,Autonomous laboratories for accelerated materials discovery: a community survey and practical insights,scientific_object_modules,04,formal_module,1,0
ASD-0437,The emergence of adaptive laboratory evolution as an efficient tool for biological discovery and industrial biotechnology,scientific_object_modules,06,formal_module,1,0
ASD-0438,"Accelerating Materials Development via Automation, Machine Learning, and High-Performance Computing",scientific_object_modules,04,formal_module,1,0
ASD-0439,Machine learning in materials science,scientific_object_modules,04,formal_module,1,0
ASD-0440,Chronic inflammation induces telomere dysfunction and accelerates ageing in mice,scientific_object_modules,07,formal_module,1,0
ASD-0441,Greener synthesis of chemical compounds and materials,scientific_object_modules,03,formal_module,1,0
ASD-0442,Automation and computer-assisted planning for chemical synthesis,scientific_object_modules,03,formal_module,1,0
ASD-0443,"Glucosinolate structural diversity, identification, chemical synthesis and metabolism in plants",scientific_object_modules,06,formal_module,1,0
ASD-0444,Abscisic Acid Synthesis and Response,scientific_object_modules,06,formal_module,1,0
ASD-0445,Review on Ammonia as a Potential Fuel: From Synthesis to Economics,scientific_object_modules,03,formal_module,1,0
ASD-0446,"Applications of Continuous-Flow Photochemistry in Organic Synthesis, Material Science, and Water Treatment",scientific_object_modules,03,formal_module,1,0
ASD-0447,An autonomous portable platform for universal chemical synthesis,scientific_object_modules,03,formal_module,1,1
ASD-0448,Universally autonomous self-healing elastomer with high stretchability,scientific_object_modules,04,formal_module,1,0
ASD-0449,Automated extraction of chemical synthesis actions from experimental procedures,scientific_object_modules,03,formal_module,1,0
ASD-0450,"Bioactive Peptides: Synthesis, Sources, Applications, and Proposed Mechanisms of Action",scientific_object_modules,06,formal_module,1,0
ASD-0451,Dynamics of non‐structural carbohydrates in terrestrial plants: a global synthesis,scientific_object_modules,06,formal_module,1,0
ASD-0452,Toward autonomous laboratories: Convergence of artificial intelligence and experimental automation,scientific_object_modules,04,formal_module,1,0
ASD-0453,Green synthesis of silver nanoparticles using Lysiloma acapulcensis exhibit high-antimicrobial activity,scientific_object_modules,04,formal_module,1,0
ASD-0454,Targeted inhibition of tumor-specific glutaminase diminishes cell-autonomous tumorigenesis,scientific_object_modules,07,formal_module,1,0
ASD-0455,A mobile robotic chemist,scientific_object_modules,04,formal_module,1,1
ASD-0456,A survey on large language model based autonomous agents,scientific_object_modules,01,formal_module,1,0
ASD-0457,Robotic tools for deep water archaeology: Surveying an ancient shipwreck with an autonomous underwater vehicle,scientific_object_modules,10,formal_module,1,0
ASD-0458,On scientific understanding with artificial intelligence,scientific_object_modules,11,formal_module,1,0
ASD-0459,Toward “On‐Demand�?Materials Synthesis and Scientific Discovery through Intelligent Robots,scientific_object_modules,04,formal_module,1,0
ASD-0461,Magnetic Actuation Methods in Bio/Soft Robotics,scientific_object_modules,09,formal_module,1,0
ASD-0462,"Artificial Intelligence (AI): Multidisciplinary perspectives on emerging challenges, opportunities, and agenda for research, practice and policy",scientific_object_modules,11,formal_module,1,0
ASD-0463,AI-driven robotic chemist for autonomous synthesis of organic molecules,scientific_object_modules,03,formal_module,1,1
ASD-0464,Integrating Scientific Knowledge with Machine Learning for Engineering and Environmental Systems,scientific_object_modules,05,formal_module,1,0
ASD-0466,Discovery of Wall-Selective Carbon Nanotube Growth Conditions <i>via</i> Automated Experimentation,scientific_object_modules,04,formal_module,1,1
ASD-0467,"A Tutorial On the design, experimentation and application of metaheuristic algorithms to real-World optimization problems",scientific_object_modules,01,formal_module,1,0
ASD-0468,Closed-loop optimization of nanoparticle synthesis enabled by robotics and machine learning,scientific_object_modules,04,formal_module,1,0
ASD-0470,Hard real-time closed-loop electrophysiology with the Real-Time eXperiment Interface (RTXI),scientific_object_modules,06,formal_module,1,0
ASD-0471,Connecting Artificial Brains to Robots in a Comprehensive Simulation Framework: The Neurorobotics Platform,scientific_object_modules,09,formal_module,1,0
ASD-0472,Dental Robotics: A Disruptive Technology,scientific_object_modules,07,formal_module,1,0
ASD-0473,"Robotics, microfluidics, nanotechnology and AI in the synthesis and evaluation of liposomes and polymeric drug delivery systems",scientific_object_modules,07,formal_module,1,0
ASD-0474,Methods and Sensors for Slip Detection in Robotics: A Survey,scientific_object_modules,09,formal_module,1,0
ASD-0475,Unlocking the efficiency of genomics laboratories with robotic liquid-handling,scientific_object_modules,06,formal_module,1,0
ASD-0476,High‐Throughput Experimentation and Computational Freeway Lanes for Accelerated Battery Electrolyte and Interface Development Research,scientific_object_modules,04,formal_module,1,0
ASD-0477,Research and development in agricultural robotics: A perspective of digital farming,scientific_object_modules,08,formal_module,1,0
ASD-0478,NIMS-OS: an automation software to implement a closed loop between artificial intelligence and robotic experiments in materials science,scientific_object_modules,04,formal_module,1,1
ASD-0479,G<scp>ryffin</scp>: An algorithm for Bayesian optimization of categorical variables informed by expert knowledge,scientific_object_modules,01,formal_module,1,0
ASD-0480,Benchmarking the performance of Bayesian optimization across multiple experimental materials science domains,scientific_object_modules,04,formal_module,1,0
ASD-0481,Bayesian optimization with known experimental and design constraints for chemistry applications,scientific_object_modules,03,formal_module,1,0
ASD-0482,Bayesian optimization with adaptive surrogate models for automated experimental design,scientific_object_modules,01,formal_module,1,0
ASD-0483,Machine learning in materials science: From explainable predictions to autonomous design,scientific_object_modules,04,formal_module,1,0
ASD-0484,Evolution-guided Bayesian optimization for constrained multi-objective optimization in self-driving labs,scientific_object_modules,04,formal_module,1,1
ASD-0485,Two-step machine learning enables optimized nanoparticle synthesis,scientific_object_modules,04,formal_module,1,0
ASD-0486,ChatGPT Research Group for Optimizing the Crystallinity of MOFs and COFs,scientific_object_modules,04,formal_module,1,0
ASD-0487,Autonomous Discovery of Battery Electrolytes with Robotic Experimentation and Machine Learning,scientific_object_modules,04,formal_module,1,1
ASD-0488,Autonomous efficient experiment design for materials discovery with Bayesian model averaging,scientific_object_modules,04,formal_module,1,0
ASD-0489,"A Review on Autonomous Vehicles: Progress, Methods and Challenges",scientific_object_modules,10,formal_module,1,0
ASD-0490,Artificial intelligence and machine learning in design of mechanical materials,scientific_object_modules,04,formal_module,1,0
ASD-0491,Optimizing Perovskite Thin-Film Parameter Spaces with Machine Learning-Guided Robotic Platform for High-Performance Perovskite Solar Cells,scientific_object_modules,04,formal_module,1,1
