paper_id,title,assignment_scope,module_code,module_kind,sort_order,active_confirmed_core
ASD-0662,Mimosa Framework: Toward Evolving Multi-Agent Systems for Scientific Research,scientific_object_modules,06,formal_module,3,1
ASD-0662,Mimosa Framework: Toward Evolving Multi-Agent Systems for Scientific Research,scientific_object_modules,11,formal_module,4,1
ASD-0663,AutoScientists: Self-Organizing Agent Teams for Long-Running Scientific Experimentation,scientific_object_modules,01,formal_module,1,1
ASD-0663,AutoScientists: Self-Organizing Agent Teams for Long-Running Scientific Experimentation,scientific_object_modules,06,formal_module,2,1
ASD-0663,AutoScientists: Self-Organizing Agent Teams for Long-Running Scientific Experimentation,scientific_object_modules,07,formal_module,3,1
ASD-0664,Autonomous computational catalysis through an agentic research system,scientific_object_modules,03,formal_module,1,1
ASD-0664,Autonomous computational catalysis through an agentic research system,scientific_object_modules,04,formal_module,2,1
ASD-0665,TSAgent: An Agentic Workflow for Autonomous Transition State Search,scientific_object_modules,03,formal_module,1,1
ASD-0666,MatClaw: An Autonomous Code-First LLM Agent for End-to-End Materials Exploration,scientific_object_modules,04,formal_module,1,1
ASD-0667,From Natural Language to Materials Discovery: The Materials Knowledge Navigation Agent,scientific_object_modules,04,formal_module,1,1
ASD-0668,Autonomous Multi-Agent AI for High-Throughput Polymer Informatics: From Property Prediction to Generative Design Across Synthetic and Bio-Polymers,scientific_object_modules,04,formal_module,1,1
ASD-0669,MARBLE: Multi-Agent Reasoning for Bioinformatics Learning and Evolution,scientific_object_modules,06,formal_module,1,1
ASD-0669,MARBLE: Multi-Agent Reasoning for Bioinformatics Learning and Evolution,scientific_object_modules,07,formal_module,2,1
ASD-0670,Mozi: Governed Autonomy for Drug Discovery LLM Agents,scientific_object_modules,07,formal_module,1,1
ASD-0671,AutoResearchClaw: Self-Reinforcing Autonomous Research with Human-AI Collaboration,scientific_object_modules,01,formal_module,1,1
ASD-0671,AutoResearchClaw: Self-Reinforcing Autonomous Research with Human-AI Collaboration,scientific_object_modules,02,formal_module,2,1
ASD-0671,AutoResearchClaw: Self-Reinforcing Autonomous Research with Human-AI Collaboration,scientific_object_modules,06,formal_module,3,1
ASD-0672,Polymer-Agent: Large Language Model Agent for Polymer Design,scientific_object_modules,04,formal_module,1,1
ASD-0673,Harnessing AtomisticSkills for Agentic Atomistic Research,scientific_object_modules,03,formal_module,1,1
ASD-0673,Harnessing AtomisticSkills for Agentic Atomistic Research,scientific_object_modules,04,formal_module,2,1
ASD-0673,Harnessing AtomisticSkills for Agentic Atomistic Research,scientific_object_modules,07,formal_module,3,1
ASD-0674,GraphAgents: Knowledge Graph-Guided Agentic AI for Cross-Domain Materials Design,scientific_object_modules,04,formal_module,1,1
ASD-0675,"MolClaw: An Autonomous Agent with Hierarchical Skills for Drug Molecule Evaluation, Screening, and Optimization",scientific_object_modules,07,formal_module,1,1
ASD-0676,AutoSci: A Memory-Centric Agentic System for the Full Scientific Research Lifecycle,scientific_object_modules,01,formal_module,1,1
ASD-0676,AutoSci: A Memory-Centric Agentic System for the Full Scientific Research Lifecycle,scientific_object_modules,06,formal_module,2,1
ASD-0676,AutoSci: A Memory-Centric Agentic System for the Full Scientific Research Lifecycle,scientific_object_modules,07,formal_module,3,1
ASD-0677,DeepRoot: A KG-Coordinated Multi-Agent System for Therapeutic Reasoning over Historical Medical Texts,scientific_object_modules,07,formal_module,1,1
ASD-0678,Latent-Y: A Lab-Validated Autonomous Agent for De Novo Drug Design,scientific_object_modules,07,formal_module,1,1
ASD-0679,Rhizome OS-1: Rhizome's Semi-Autonomous Operating System for Small Molecule Drug Discovery,scientific_object_modules,03,formal_module,1,1
ASD-0679,Rhizome OS-1: Rhizome's Semi-Autonomous Operating System for Small Molecule Drug Discovery,scientific_object_modules,07,formal_module,2,1
ASD-0680,Agentic Fusion of Large Atomic and Language Models to Accelerate Superconductor Discovery,scientific_object_modules,04,formal_module,1,1
ASD-0681,Agentic LLM Reasoning in a Self-Driving Laboratory for Air-Sensitive Lithium Halide Spinel Conductors,scientific_object_modules,04,formal_module,1,1
ASD-0682,El Agente S��lido: A New Age(nt) for Solid State Simulations,scientific_object_modules,04,formal_module,1,1
ASD-0683,PeroMAS: A Multi-agent System of Perovskite Material Discovery,scientific_object_modules,04,formal_module,1,1
ASD-0684,ChemNavigator: Agentic AI Discovery of Design Rules for Organic Photocatalysts,scientific_object_modules,03,formal_module,1,1
ASD-0685,STELLA: Self-Evolving LLM Agent for Biomedical Research,scientific_object_modules,06,formal_module,1,0
ASD-0686,From Intention To Implementation: Automating Biomedical Research via LLMs,scientific_object_modules,06,formal_module,1,0
ASD-0687,Agentic AI for Multi-Stage Physics Experiments at a Large-Scale User Facility Particle Accelerator,scientific_object_modules,02,formal_module,1,1
ASD-0688,"OpenFOAMGPT 2.0: end-to-end, trustworthy automation for computational fluid dynamics",scientific_object_modules,09,formal_module,1,1
ASD-0689,A Large Language Model-Empowered Agent for Reliable and Robust Structural Analysis,scientific_object_modules,09,formal_module,1,0
ASD-0690,Knowledge-Driven Agentic Scientific Corpus Distillation Framework for Biomedical Large Language Models Training,scientific_object_modules,11,formal_module,1,0
ASD-0691,OASIS: Onboard Autonomous Science Investigation System for Opportunistic Rover Science,scientific_object_modules,05,formal_module,1,1
ASD-0691,OASIS: Onboard Autonomous Science Investigation System for Opportunistic Rover Science,scientific_object_modules,10,formal_module,2,1
ASD-0692,Essential Autonomous Science Inference for Remote Sensing,scientific_object_modules,10,formal_module,1,0
ASD-0693,Enabling Onboard Detection of Events of Scientific Interest for the Europa Clipper Spacecraft,scientific_object_modules,05,formal_module,1,1
ASD-0693,Enabling Onboard Detection of Events of Scientific Interest for the Europa Clipper Spacecraft,scientific_object_modules,10,formal_module,2,1
ASD-0694,Autonomous surface sampling for the Europa Lander mission concept,scientific_object_modules,10,formal_module,1,0
ASD-0695,FoodPuzzle: Developing Large Language Model Agents as Flavor Scientists,scientific_object_modules,08,formal_module,1,1
ASD-0696,AEGIS Automated Science Targeting for the MER Opportunity Rover,scientific_object_modules,05,formal_module,1,1
ASD-0696,AEGIS Automated Science Targeting for the MER Opportunity Rover,scientific_object_modules,10,formal_module,2,1
ASD-0697,AEGIS autonomous targeting for ChemCam on Mars Science Laboratory: Deployment and results of initial science team use,scientific_object_modules,05,formal_module,1,1
ASD-0697,AEGIS autonomous targeting for ChemCam on Mars Science Laboratory: Deployment and results of initial science team use,scientific_object_modules,10,formal_module,2,1
ASD-0698,APRES: An Agentic Paper Revision and Evaluation System,scientific_object_modules,11,formal_module,1,1
ASD-0699,ARA: Agentic Reproducibility Assessment For Scalable Support Of Scientific Peer-Review,scientific_object_modules,11,formal_module,1,1
ASD-0700,Reimagining Peer Review Process Through Multi-Agent Mechanism Design,scientific_object_modules,11,formal_module,1,0
ASD-0701,Automating Computational Reproducibility in Social Science: Comparing Prompt-Based and Agent-Based Approaches,scientific_object_modules,11,formal_module,1,1
ASD-0702,Rover-Based Autonomous Science by Probabilistic Identification and Evaluation,scientific_object_modules,05,formal_module,1,1
ASD-0702,Rover-Based Autonomous Science by Probabilistic Identification and Evaluation,scientific_object_modules,10,formal_module,2,1
ASD-0703,Autonomous Science Agents and Sensor Webs: EO-1 and Beyond,scientific_object_modules,05,formal_module,1,1
ASD-0703,Autonomous Science Agents and Sensor Webs: EO-1 and Beyond,scientific_object_modules,10,formal_module,2,1
ASD-0704,PaperRepro: Automated Computational Reproducibility Assessment for Social Science Papers,scientific_object_modules,11,formal_module,1,1
ASD-0705,Automated reproducibility assessments in the social and behavioral sciences using large language models,scientific_object_modules,11,formal_module,1,1
ASD-0706,aiXiv: A Next-Generation Open Access Ecosystem for Scientific Discovery Generated by AI Scientists,scientific_object_modules,11,formal_module,1,1
ASD-0707,ArgoLOOM: agentic AI for fundamental physics from quarks to cosmos,scientific_object_modules,02,formal_module,1,1
ASD-0708,GenoMAS: A Multi-Agent Framework for Scientific Discovery via Code-Driven Gene Expression Analysis,scientific_object_modules,06,formal_module,1,1
ASD-0709,Automated Targeting for the MSL Rover ChemCam Spectrometer,scientific_object_modules,05,formal_module,1,1
ASD-0709,Automated Targeting for the MSL Rover ChemCam Spectrometer,scientific_object_modules,10,formal_module,2,1
ASD-0710,AEGIS Autonomous Targeting for the SuperCam Instrument on the Mars 2020 Perseverance Rover,scientific_object_modules,05,formal_module,1,1
ASD-0710,AEGIS Autonomous Targeting for the SuperCam Instrument on the Mars 2020 Perseverance Rover,scientific_object_modules,10,formal_module,2,1
ASD-0711,Developing Autonomous Science Technology for the MSL Rover Mission,scientific_object_modules,05,formal_module,1,1
ASD-0711,Developing Autonomous Science Technology for the MSL Rover Mission,scientific_object_modules,10,formal_module,2,1
ASD-0712,Enabling Autonomous Rover Science Through Dynamic Planning and Scheduling,scientific_object_modules,10,formal_module,1,1
ASD-0713,Demonstrating Autonomy for Complex Space Missions: A Europa Lander Mission Autonomy Prototype,scientific_object_modules,10,formal_module,1,1
ASD-0714,K-Dense Analyst: Towards Fully Automated Scientific Analysis,scientific_object_modules,06,formal_module,1,1
ASD-0714,K-Dense Analyst: Towards Fully Automated Scientific Analysis,scientific_object_modules,07,formal_module,2,1
ASD-0715,"BioDisco: Multi-agent hypothesis generation with dual-mode evidence, iterative feedback and temporal evaluation",scientific_object_modules,07,formal_module,1,1
ASD-0715,"BioDisco: Multi-agent hypothesis generation with dual-mode evidence, iterative feedback and temporal evaluation",scientific_object_modules,06,formal_module,2,1
ASD-0716,"Bio AI Agent: A Multi-Agent Artificial Intelligence System for Autonomous CAR-T Cell Therapy Development with Integrated Target Discovery, Toxicity Prediction, and Rational Molecular Design",scientific_object_modules,07,formal_module,1,1
ASD-0717,Paper Circle: An Open-source Multi-agent Research Discovery and Analysis Framework,scientific_object_modules,11,formal_module,1,1
ASD-0718,AI Coding Agents Can Reproduce Social Science Findings,scientific_object_modules,11,formal_module,1,0
ASD-0719,Mission Operations of Earth Observing-1 with Onboard Autonomy,scientific_object_modules,05,formal_module,1,1
ASD-0719,Mission Operations of Earth Observing-1 with Onboard Autonomy,scientific_object_modules,10,formal_module,2,1
ASD-0720,Lessons Learned from Autonomous Sciencecraft Experiment,scientific_object_modules,10,formal_module,1,0
ASD-0721,Integrated AI in Space: The Autonomous Sciencecraft on Earth Observing One,scientific_object_modules,05,formal_module,1,1
ASD-0721,Integrated AI in Space: The Autonomous Sciencecraft on Earth Observing One,scientific_object_modules,10,formal_module,2,1
ASD-0722,An Autonomous Earth-Observing Sensorweb,scientific_object_modules,05,formal_module,1,1
ASD-0722,An Autonomous Earth-Observing Sensorweb,scientific_object_modules,10,formal_module,2,1
ASD-0723,CASSIA: a multi-agent large language model for automated and interpretable cell annotation,scientific_object_modules,06,formal_module,1,1
ASD-0724,Autonomous seeking and mapping coral reef biodiversity hotspots with a multimodal AUV,scientific_object_modules,06,formal_module,1,1
ASD-0725,TianJi-Environ: An Autonomous AI Scientist for Atmospheric Environmental Research,scientific_object_modules,05,formal_module,1,1
ASD-0726,AutoClimDS: Climate Data Science Agentic AI -- A Knowledge Graph is All You Need,scientific_object_modules,05,formal_module,1,1
ASD-0727,GeoAgentic-RAG: A Multi-Agent framework for autonomous geospatial reasoning and visual insight generation with LLM,scientific_object_modules,05,formal_module,1,1
ASD-0728,CellForge: Agentic Design of Virtual Cell Models,scientific_object_modules,06,formal_module,1,1
ASD-0729,Self-evolving AI agents for protein discovery and directed evolution,scientific_object_modules,06,formal_module,1,1
ASD-0730,"Traxia: A Framework for Verifiable, Agent-Native Scientific Publishing",scientific_object_modules,11,formal_module,1,0
ASD-0731,Self-Driving Datasets: From 20 Million Papers to Nuanced Biomedical Knowledge at Scale,scientific_object_modules,03,formal_module,1,1
ASD-0731,Self-Driving Datasets: From 20 Million Papers to Nuanced Biomedical Knowledge at Scale,scientific_object_modules,06,formal_module,2,1
ASD-0731,Self-Driving Datasets: From 20 Million Papers to Nuanced Biomedical Knowledge at Scale,scientific_object_modules,07,formal_module,3,1
ASD-0732,Enhancing Science and Automating Operations Using Onboard Autonomy,scientific_object_modules,10,formal_module,1,0
ASD-0733,"Increased Mars Rover Autonomy using AI Planning, Scheduling and Execution",scientific_object_modules,10,formal_module,1,1
ASD-0734,Controlling an organic synthesis robot with machine learning to search for new reactivity,scientific_object_modules,03,formal_module,1,1
ASD-0735,Artificial Chemist: An Autonomous Quantum Dot Synthesis Bot,scientific_object_modules,04,formal_module,1,1
ASD-0736,AI-Researcher: Autonomous Scientific Innovation,scientific_object_modules,01,formal_module,1,1
ASD-0737,ScientistOne: Towards Human-Level Autonomous Research via Chain-of-Evidence Verification,scientific_object_modules,01,formal_module,1,1
ASD-0738,AutoSOTA: An End-to-End Automated Research System for State-of-the-Art AI Model Discovery,scientific_object_modules,01,formal_module,1,1
ASD-0739,Autonomous microfluidic experimentation for exploring reaction inference and synthesizing double perovskite nanoplatelets,scientific_object_modules,03,formal_module,1,1
ASD-0739,Autonomous microfluidic experimentation for exploring reaction inference and synthesizing double perovskite nanoplatelets,scientific_object_modules,04,formal_module,2,1
ASD-0740,Discovery of tunable and soluble organic emitters for solid-state lasers with a self-driving laboratory,scientific_object_modules,03,formal_module,1,1
ASD-0740,Discovery of tunable and soluble organic emitters for solid-state lasers with a self-driving laboratory,scientific_object_modules,04,formal_module,2,1
ASD-0741,Spatial transcriptomics AI agent charts hPSC-pancreas maturation in vivo,scientific_object_modules,06,formal_module,1,1
ASD-0742,Talk2Biomodels: AI agent-based open-source LLM initiative for kinetic biological models,scientific_object_modules,06,formal_module,1,1
ASD-0742,Talk2Biomodels: AI agent-based open-source LLM initiative for kinetic biological models,scientific_object_modules,07,formal_module,2,1
ASD-0743,STAT: A multi-agent framework for integrated and interactive spatial transcriptomics analysis,scientific_object_modules,06,formal_module,1,1
ASD-0743,STAT: A multi-agent framework for integrated and interactive spatial transcriptomics analysis,scientific_object_modules,07,formal_module,2,1
ASD-0744,"BioGAIP: A Scalable, User-Friendly and Robust LLM-Powered Multi-Agent System for Automated Bioinformatics Tasks",scientific_object_modules,06,formal_module,1,1
ASD-0744,"BioGAIP: A Scalable, User-Friendly and Robust LLM-Powered Multi-Agent System for Automated Bioinformatics Tasks",scientific_object_modules,07,formal_module,2,1
ASD-0745,BioLab: End-to-End Autonomous Life Sciences Research with Multi-Agents System Integrating Biological Foundation Models,scientific_object_modules,06,formal_module,1,1
ASD-0745,BioLab: End-to-End Autonomous Life Sciences Research with Multi-Agents System Integrating Biological Foundation Models,scientific_object_modules,07,formal_module,2,1
ASD-0746,Enabling Autonomous Rover Science Through Dynamic Planning and Scheduling,scientific_object_modules,10,formal_module,1,0
ASD-0747,VFEAgent: A Multimodal Agent Framework for End-to-End Automated Finite Element Analysis,scientific_object_modules,09,formal_module,1,1
ASD-0748,ASTER -- Agentic Science Toolkit for Exoplanet Research,scientific_object_modules,02,formal_module,1,1
ASD-0749,Self-Refining Topology Optimization via an LLM-Based Multi-Agent Framework,scientific_object_modules,09,formal_module,1,1
ASD-0750,GRACE: an Agentic AI for Particle Physics Experiment Design and Simulation,scientific_object_modules,02,formal_module,1,1
ASD-0751,Beyond AI as Assistants: Toward Autonomous Discovery in Cosmology,scientific_object_modules,02,formal_module,1,1
ASD-0752,Integrating Large Language Models for Automated Structural Analysis,scientific_object_modules,09,formal_module,1,1
ASD-0753,A Lightweight Large Language Model-Based Multi-Agent System for 2D Frame Structural Analysis,scientific_object_modules,09,formal_module,1,1
ASD-0754,Automating Structural Engineering Workflows with Large Language Model Agents,scientific_object_modules,09,formal_module,1,1
ASD-0755,Automating Structural Analysis Across Multiple Software Platforms Using Large Language Models,scientific_object_modules,09,formal_module,1,1
ASD-0756,Agentic Large Language Models for Automated Structural Analysis of 3D Frame Systems,scientific_object_modules,09,formal_module,1,1
ASD-0757,CADSmith: Multi-Agent CAD Generation with Programmatic Geometric Validation,scientific_object_modules,09,formal_module,1,1
ASD-0758,Self-Improving CAD Generation Agents with Finite Element Analysis as Feedback,scientific_object_modules,09,formal_module,1,1
ASD-0759,PhysMaster: Building an Autonomous AI Physicist for Theoretical and Computational Physics Research,scientific_object_modules,02,formal_module,1,1
ASD-0760,Towards autonomous quantum physics research using LLM agents with access to intelligent tools,scientific_object_modules,02,formal_module,1,1
ASD-0761,AI Agents for Variational Quantum Circuit Design,scientific_object_modules,02,formal_module,1,1
ASD-0762,LLM-based Multi-Agent Copilot for Quantum Sensor,scientific_object_modules,02,formal_module,1,1
ASD-0763,From Experimental Limits to Physical Insight: A Retrieval-Augmented Multi-Agent Framework for Interpreting Searches Beyond the Standard Model,scientific_object_modules,02,formal_module,1,1
ASD-0764,An agentic framework for gravitational-wave counterpart association in the multi-messenger era,scientific_object_modules,02,formal_module,1,1
ASD-0765,CLIMATEAGENT: Multi-Agent Orchestration for Complex Climate Data Science Workflows,scientific_object_modules,05,formal_module,1,1
ASD-0766,"ReviewGrounder: Improving Review Substantiveness with Rubric-Guided, Tool-Integrated Agents",scientific_object_modules,11,formal_module,1,1
ASD-0767,EGTR-Review: Efficient Evidence-Grounded Scientific Peer Review Generation via Multi-Agent Teacher Distillation,scientific_object_modules,11,formal_module,1,0
ASD-0768,When Reviews Disagree: Fine-Grained Contradiction Analysis in Scientific Peer Reviews,scientific_object_modules,11,formal_module,1,1
ASD-0769,DeepER-Med: Advancing Deep Evidence-Based Research in Medicine Through Agentic AI,scientific_object_modules,07,formal_module,1,1
ASD-0770,Progressive Multi-Agent Reasoning for Biological Perturbation Prediction,scientific_object_modules,06,formal_module,1,1
ASD-0770,Progressive Multi-Agent Reasoning for Biological Perturbation Prediction,scientific_object_modules,07,formal_module,2,1
ASD-0771,Process-Supervised Multi-Agent Reinforcement Learning for Reliable Clinical Reasoning,scientific_object_modules,07,formal_module,1,1
ASD-0772,TRACE: A Multi-Agent System for Autonomous Physical Reasoning for Seismology,scientific_object_modules,05,formal_module,1,1
ASD-0773,Skill-Augmented AI Agents for Medical Research Analysis: An Exploratory Multi-Model Human Evaluation in an NSCLC Transcriptomic Biomarker Task,scientific_object_modules,07,formal_module,1,1
ASD-0774,Causal-Enhanced AI Agents for Medical Research Screening,scientific_object_modules,07,formal_module,1,1
ASD-0775,Owl-AuraID 1.0: An Intelligent System for Autonomous Scientific Instrumentation and Scientific Data Analysis,scientific_object_modules,09,formal_module,1,1
ASD-0776,TerraBench: Can Agents Reason Over Heterogeneous Earth-System Data?,scientific_object_modules,05,formal_module,1,0
ASD-0777,GeoDisaster: Benchmarking Orchestrated Agents for Operational Disaster Geo-Intelligence,scientific_object_modules,05,formal_module,1,0
ASD-0778,Agentic publications: redesigning scientific publishing in the age of thinking large language models,scientific_object_modules,11,formal_module,1,0
ASD-0779,From Text to Simulation: A Multi-Agent LLM Workflow for Automated Chemical Process Design,scientific_object_modules,09,formal_module,1,1
ASD-0780,Context is all you need: Towards autonomous model-based process design using agentic AI in flowsheet simulations,scientific_object_modules,09,formal_module,1,1
ASD-0781,Large Language Model Agent for User-friendly Chemical Process Simulations,scientific_object_modules,09,formal_module,1,1
ASD-0782,"CFDagent: A Language-Guided, Zero-Shot Multi-Agent System for Complex Flow Simulation",scientific_object_modules,02,formal_module,1,1
ASD-0782,"CFDagent: A Language-Guided, Zero-Shot Multi-Agent System for Complex Flow Simulation",scientific_object_modules,09,formal_module,2,1
ASD-0783,RemoteAgent: Bridging Vague Human Intents and Earth Observation with RL-based Agentic MLLMs,scientific_object_modules,05,formal_module,1,1
ASD-0784,GISclaw: A Comprehensive Open-Source LLM Agent System for Realistic Multi-Step Geospatial Analysis,scientific_object_modules,05,formal_module,1,1
ASD-0785,Multi-Agent Geospatial Copilots for Remote Sensing Workflows,scientific_object_modules,05,formal_module,1,0
ASD-0786,AgentReview: Exploring Peer Review Dynamics with LLM Agents,scientific_object_modules,11,formal_module,1,1
ASD-0787,SciToolAgent: a knowledge-graph-driven scientific agent for multitool integration,scientific_object_modules,03,formal_module,1,1
ASD-0787,SciToolAgent: a knowledge-graph-driven scientific agent for multitool integration,scientific_object_modules,04,formal_module,2,1
ASD-0787,SciToolAgent: a knowledge-graph-driven scientific agent for multitool integration,scientific_object_modules,06,formal_module,3,1
ASD-0788,GeneAgent: self-verification language agent for gene-set analysis using domain databases,scientific_object_modules,06,formal_module,1,0
ASD-0789,TEM Agent: enhancing transmission electron microscopy with modern AI tools,scientific_object_modules,09,formal_module,1,1
ASD-0790,Hierarchical Multi-agent Large Language Model Reasoning for Autonomous Heterogeneous Catalyst Discovery,scientific_object_modules,03,formal_module,1,1
ASD-0790,Hierarchical Multi-agent Large Language Model Reasoning for Autonomous Heterogeneous Catalyst Discovery,scientific_object_modules,04,formal_module,2,1
ASD-0791,Escaping the hydrolysis trap: a react agent for inverse design of durable photocatalytic covalent organic frameworks,scientific_object_modules,04,formal_module,1,1
ASD-0792,Autonomous heterogeneous catalyst discovery with a self-evolving multi-agent digital twin,scientific_object_modules,03,formal_module,1,1
ASD-0792,Autonomous heterogeneous catalyst discovery with a self-evolving multi-agent digital twin,scientific_object_modules,04,formal_module,2,1
ASD-0793,Adsorb-Agent: Autonomous Identification of Stable Adsorption Configurations via Large Language Model Agent,scientific_object_modules,03,formal_module,1,1
ASD-0794,The HTC-Claw: Automating Discovery through High-Throughput Computational Campaigns,scientific_object_modules,04,formal_module,1,1
ASD-0795,OpenAaaS: An Open Agent-as-a-Service Framework for Distributed Materials-Informatics Research,scientific_object_modules,09,formal_module,1,0
ASD-0796,Bridging Perception and Action: A Lightweight Multimodal Meta-Planner Framework for Robust Earth Observation Agents,scientific_object_modules,05,formal_module,1,1
ASD-0797,CP-Agent: Context-Aware Multimodal Reasoning for Cellular Morphological Profiling under Chemical Perturbations,scientific_object_modules,06,formal_module,1,1
ASD-0798,Molecular Lead Optimization via Agentic Tool Planning,scientific_object_modules,07,formal_module,1,1
ASD-0799,CeProAgents: A Hierarchical Agents System for Automated Chemical Process Development,scientific_object_modules,09,formal_module,1,1
ASD-0800,Risk-Aware LLM Agents for Geospatial Data Retrieval: Design and Preliminary Adversarial Evaluation,scientific_object_modules,05,formal_module,1,1
ASD-0801,Advancing Subsurface Discovery and Geothermal Monitoring with an Agentic Artificial Intelligence Framework,scientific_object_modules,05,formal_module,1,1
ASD-0802,Exploring Robust Multi-Agent Workflows for Environmental Data Management,scientific_object_modules,05,formal_module,1,0
ASD-0803,ClimateAgents: A Multi-Agent Research Assistant for Social-Climate Dynamics Analysis,scientific_object_modules,05,formal_module,1,1
ASD-0803,ClimateAgents: A Multi-Agent Research Assistant for Social-Climate Dynamics Analysis,scientific_object_modules,11,formal_module,2,1
ASD-0804,Sketch2Simulation: Automating Flowsheet Generation via Multi Agent Large Language Models,scientific_object_modules,09,formal_module,1,1
